{
  "$schema": "https://json-schema.org/draft/2020-12/schema",
  "$id": "https://github.com/DTCurrie/houserules/blob/main/schema/houserules.config.schema.json",
  "title": "houserules config",
  "description": "Per-repo configuration for houserules (.claude/houserules.config.json).",
  "type": "object",
  "properties": {
    "_help": { "type": "string" },
    "_notes": {
      "type": "object",
      "propertyNames": { "type": "string" },
      "additionalProperties": { "type": "string" }
    },
    "$schema": { "type": "string" },
    "version": {
      "type": "number",
      "const": 2,
      "description": "Config schema version."
    },
    "packageManager": { "type": "string", "minLength": 1 },
    "fix": {
      "type": "object",
      "properties": {
        "runner": {
          "type": "string",
          "minLength": 1,
          "description": "Package manager binary, e.g. \"pnpm\"."
        },
        "filterFlag": {
          "type": "string",
          "description": "Workspace filter flag, e.g. \"--filter\". Empty for a single-package repo."
        },
        "runScriptPrefix": {
          "type": "array",
          "items": { "type": "string" },
          "description": "Argv between the runner and the script name, e.g. [\"run\"]."
        },
        "commands": {
          "type": "array",
          "items": { "type": "string" },
          "description": "package.json scripts to run, in order."
        },
        "onSubagentStop": {
          "description": "Run the fixer when a SUBAGENT stops. Off by default: parallel workers would each fix every package at once.",
          "type": "boolean"
        },
        "commandExtensions": {
          "description": "Per-fix-command file extensions, e.g. {\"lint:fix\": [\"ts\",\"tsx\"]}. Narrows which changed files trigger which fixer.",
          "type": "object",
          "propertyNames": { "type": "string" },
          "additionalProperties": {
            "type": "array",
            "items": { "type": "string" }
          }
        }
      },
      "required": ["runner", "filterFlag", "runScriptPrefix", "commands"],
      "additionalProperties": false
    },
    "verify": {
      "description": "Only present when the verify-changed module is enabled.",
      "type": "object",
      "properties": {
        "runner": {
          "type": "string",
          "minLength": 1,
          "description": "Package manager binary, e.g. \"pnpm\"."
        },
        "filterFlag": {
          "type": "string",
          "description": "Workspace filter flag, e.g. \"--filter\". Empty for a single-package repo."
        },
        "runScriptPrefix": {
          "type": "array",
          "items": { "type": "string" },
          "description": "Argv between the runner and the script name, e.g. [\"run\"]."
        },
        "commands": {
          "type": "array",
          "items": { "type": "string" },
          "description": "package.json scripts to run, in order."
        },
        "baseBranch": {
          "description": "Branch the changed-file diff is taken against. Defaults to changesets.baseBranch, then \"main\".",
          "type": "string"
        },
        "timeoutMs": {
          "description": "Wall-clock cap in milliseconds, applied to each verify command separately. Unset means no cap. A command over the cap is reported as \"FAIL (<step>, timed out after <n>s)\".",
          "type": "integer",
          "exclusiveMinimum": 0,
          "maximum": 9007199254740991
        }
      },
      "required": ["runner", "filterFlag", "runScriptPrefix", "commands"],
      "additionalProperties": false
    },
    "lintableExtensions": { "type": "array", "items": { "type": "string" } },
    "generatedFilePattern": {
      "description": "Regex source; files matching it are never auto-fixed.",
      "type": "string"
    },
    "guard": {
      "type": "object",
      "properties": {
        "gitCommit": { "type": "boolean" },
        "gitPush": { "type": "boolean" },
        "gitStash": { "type": "boolean" },
        "gitDiscard": { "type": "boolean" },
        "prCreate": { "type": "boolean" },
        "custom": {
          "type": "array",
          "items": {
            "type": "object",
            "properties": {
              "pattern": { "type": "string" },
              "message": { "type": "string" }
            },
            "required": ["pattern", "message"],
            "additionalProperties": false
          }
        }
      },
      "additionalProperties": false
    },
    "changesets": {
      "type": "object",
      "properties": {
        "enabled": { "type": "boolean" },
        "stopCheck": { "type": "boolean" },
        "baseBranch": { "type": "string" },
        "gateIgnore": {
          "description": "Globs of repo-relative paths the Stop-hook changeset gate never counts as a touched package, for edits that ship nothing.",
          "type": "array",
          "items": { "type": "string" }
        }
      },
      "additionalProperties": false
    },
    "ledger": {
      "type": "object",
      "properties": { "enabled": { "type": "boolean" } },
      "additionalProperties": false
    },
    "decisions": {
      "type": "object",
      "properties": { "enabled": { "type": "boolean" } },
      "additionalProperties": false
    },
    "projects": {
      "description": "Read at runtime by the projects plugin's scripts. Top level rather than inside its `plugins[].config` entry, because a payload script does not know the alias its own plugin was declared under, so it cannot find that entry.",
      "type": "object",
      "properties": {
        "autoSync": {
          "description": "Set false to forbid ledger syncing repo-wide. True only permits it: a push still needs a local .claude/ledgers/.projects.json, which only `bootstrap` writes, and maintain or admin on the repository.",
          "type": "boolean"
        }
      },
      "additionalProperties": false
    },
    "design": {
      "description": "Read at runtime by the design plugin's scripts. Top level rather than inside its `plugins[].config` entry, for the same reason as `projects`: a payload script cannot find the entry its own plugin was declared under.",
      "type": "object",
      "properties": {
        "themeEntry": {
          "description": "Repo-root-relative path to the stylesheet Tailwind compiles, for a repo where more than one imports it. Read at runtime by design.mjs, which otherwise tries every stylesheet that imports Tailwind in walk order. A configured entry that fails to compile is an error naming this key, with no fallback.",
          "type": "string"
        }
      },
      "additionalProperties": false
    },
    "orchestrate": {
      "description": "Read at plan time by the orchestrate module, and at runtime by `wave-ceiling.mjs`. Top level like `projects`, since the module is built in and has no `plugins[].config` entry.",
      "type": "object",
      "properties": {
        "workerTools": {
          "description": "Extra tools appended to the `tools:` line of task-worker and every installed variant by `houserules update`. Each entry is a full callable name, `mcp__<server>__<tool>` such as \"mcp__svelte__svelte-autofixer\", or a server pattern, `mcp__<server>` or `mcp__<server>__*` (Claude Code 2.1.299+), for an MCP tool a repo rule requires.",
          "type": "array",
          "items": { "type": "string" }
        },
        "maxWorkers": {
          "description": "The most task-workers one /orchestrate wave dispatches at once. Read at runtime by `wave-ceiling.mjs`, which otherwise derives the ceiling from the machine: half the CPU count, at least 2, halved again when the one-minute load is at or above the CPU count. Set it higher than the CPU count and it still wins, since it is an explicit override.",
          "type": "integer",
          "exclusiveMinimum": 0,
          "maximum": 9007199254740991
        }
      },
      "additionalProperties": false
    },
    "ledgers": {
      "type": "object",
      "properties": {
        "dir": {
          "description": "Where the backlog and decision ledgers live, relative to the repo root. Holds the `.jsonl` logs and the markdown rendered from them. The whole directory is gitignored. Defaults to `.claude/ledgers`. One directory per repo: a monorepo distinguishes areas by filename, such as `studio.BACKLOG.md`, not by nesting.",
          "type": "string"
        }
      },
      "additionalProperties": false
    },
    "claudeMd": {
      "type": "object",
      "properties": {
        "managed": {
          "description": "Let houserules maintain its marked block in the instructions file (CLAUDE.md, or AGENTS.md). Set false to opt out; houserules then never touches the file.",
          "type": "boolean"
        }
      },
      "additionalProperties": false
    },
    "instructionsFile": {
      "description": "Which file carries the houserules block. Unset, houserules honors the file the repo already has: CLAUDE.md when present, else AGENTS.md when present, else it seeds CLAUDE.md. Set it to force one. Claude Code reads AGENTS.md on its own only when no CLAUDE.md, .claude/CLAUDE.md, or CLAUDE.local.md exists in the working directory or above it.",
      "type": "string",
      "enum": ["CLAUDE.md", "AGENTS.md"]
    },
    "readGuard": {
      "type": "object",
      "properties": {
        "enabled": { "type": "boolean" },
        "maxBytes": {
          "type": "integer",
          "exclusiveMinimum": 0,
          "maximum": 9007199254740991
        },
        "denyGlobs": { "type": "array", "items": { "type": "string" } }
      },
      "additionalProperties": false
    },
    "scripts": {
      "type": "object",
      "properties": {
        "commit": {
          "description": "Keep .claude/scripts/ committed instead of gitignored. Off by default: the scripts are build output, refreshed by `npx houserules update`.",
          "type": "boolean"
        }
      },
      "additionalProperties": false
    },
    "plugins": {
      "description": "Plugins contributing extra modules, resolved in this order.",
      "type": "array",
      "items": {
        "type": "object",
        "properties": {
          "name": {
            "type": "string",
            "minLength": 1,
            "description": "npm package name, or a repo-relative path to a directory holding a package.json."
          },
          "alias": {
            "type": "string",
            "minLength": 1,
            "pattern": "^[a-z0-9][a-z0-9-]*$",
            "description": "Id namespace for this plugin's modules. A module `prose-voice` under alias `voice` is selected as \"voice/prose-voice\"."
          },
          "config": {
            "description": "Passed to the plugin verbatim. houserules never reads inside it."
          }
        },
        "required": ["name", "alias"],
        "additionalProperties": false
      }
    },
    "moduleOptions": {
      "description": "Per-module option selections, keyed by module id. Persisted so update and doctor never have to ask again.",
      "type": "object",
      "propertyNames": { "type": "string" },
      "additionalProperties": { "type": "array", "items": { "type": "string" } }
    },
    "targets": {
      "type": "array",
      "items": {
        "type": "object",
        "properties": {
          "name": {
            "type": "string",
            "minLength": 1,
            "description": "Kebab short name; used in generated filenames."
          },
          "prefix": {
            "type": "string",
            "minLength": 1,
            "description": "Uppercase backlog-id prefix, e.g. \"CORE\"."
          },
          "packageName": {
            "type": "string",
            "description": "package.json name, or \".\" for a rootless repo."
          },
          "pathPrefix": {
            "type": "string",
            "description": "Repo-relative dir with a trailing slash; \"\" for a single-package repo."
          },
          "sourcePath": {
            "type": "string",
            "description": "Where this target's source lives."
          },
          "label": {
            "type": "string",
            "description": "Human label, e.g. \"Core\"."
          },
          "fixCommands": {
            "description": "Per-target override of fix.commands. Real repos diverge.",
            "anyOf": [
              { "type": "array", "items": { "type": "string" } },
              { "type": "null" }
            ]
          },
          "verifyCommands": {
            "description": "Per-target override of verify.commands.",
            "anyOf": [
              { "type": "array", "items": { "type": "string" } },
              { "type": "null" }
            ]
          },
          "changelogPath": {
            "description": "Ledger module only.",
            "type": "string"
          },
          "logPath": { "description": "Ledger module only.", "type": "string" },
          "regen": {
            "description": "Regen module: re-run `command` when a file matching `sourceGlob` is edited.",
            "type": "object",
            "properties": {
              "sourceGlob": { "type": "string" },
              "command": { "type": "string" }
            },
            "required": ["sourceGlob", "command"],
            "additionalProperties": false
          }
        },
        "required": [
          "name",
          "prefix",
          "packageName",
          "pathPrefix",
          "sourcePath",
          "label"
        ],
        "additionalProperties": false
      },
      "description": "The packages/areas houserules tracks."
    }
  },
  "required": ["version", "packageManager", "targets"],
  "additionalProperties": false
}
